id,texto
1,"Nacimiento de Juan Pérez, 15/03/1995, Madrid. Registro Civil Sección 3ª, Tomo 122, Folio 45."
2,"Matrimonio de Ana López y Luis García, 20/06/2010, Sevilla. Acta nº 6789."
3,"Defunción de María Díaz, 02/11/1980, Valencia. Certificado emitido por el Encargado del Registro."
4,"Cambio de domicilio de Pedro Martín, 01/01/2021, Zaragoza. Resolución administrativa 2021/45."
5,"Inscripción de adopción de Sofía Ruiz, 14/02/2017, Bilbao. Oficio nº 334/2017."
6,"Rectificación de nombre: de 'Carla' a 'Karla', 23/09/2023, Málaga. Auto judicial 103/2023."
